Q,Category,K1,K2,K3,K4,A
「紳々の運命」という意味がある、北欧利話における世界終末の日は回角,文系,ミョルニル,ラグナロク,グレイプニル,フィンブル,ラグナロク
次のうち、「先頭に立って物事を進める」という意味の言葉はどれ3?,文系,音楽に乗る,音階を聞く,音符を読む,音頭を取る,音頭を取る
『君が代』 といえば、どこの国の国歌?,文系,タイ,韓国,日本,インド,日本
「親潮」とも呼ばれる、日本近海を流れる海流は何 ?,文系,千島海流,アラスカ海流,択捉海流,カムチャツカ海流,千島海流
とよのか、とちおとめ、女峰、あまおうと言えばどんな上果物の品種?,文系,すいか,りんご,ぶどう,いちご,いちご
東南アジアに位置するタイ王国の通人買は2,文系,バーツ,リアル,ナャット,リンギ,バーツ
日本紳話に登場する、東征に向かう紳武天皇を導いたとされる3本足の島は何 ?,文系,ヤタヒバリ,ヤタチドリ,ヤタガラス,ヤタスズメ,ヤタガラス
東西交易で栄えた中国から地中海沿岸までを結ぶ中央アジアの交通路を、代表的な交易品から何という ?,文系,ウールロード,コットンロード,カシミアロード,シルクロード,シルクロード
キング牧師が1963年の演説で述べた有名なフレーズ 「Ihave a 〇〇(〇」 o 〇〇〇は何 ?,文系,dream,book,Cat,apple,dream
12世紀に源頼朝によって創始された幕府は何2    「,文系,,相模原幕府,川崎幕府,鍵昼幕府,鍵昼幕府
次のうち、「世界三大洋」に含まれないのはどれ2?,文系,大泉洋,インド洋,太下洋,大西洋,大泉洋
次のうち、北海道の都市はどれ ?,文系,岩国市,千歳市,彦根市,沼津市,千歳市
『容疑者Xの献身』『白夜行』などの代表作がある推理小説家は誰 ?,文系,東野詩吾,南野詩吾,北野圭吾,西野圭吾,東野詩吾
1860年、大老の井伊直納が江戸城の前で暗殺された事件は何 ?,文系,坂下門外の変,桜田門外の変,貼御門の変,応天門の変,桜田門外の変
かつて政治の中心地となった江戸の町を、体の一部を使って「将軍の何」と呼んだ?,文系,お胸もと,お腰もと,お膝もと,お血もと,お膝もと
心に余裕がなくせっぱつまった様子を、廊雀用語に由来する言葉で何という ?,文系,テンパる,デッパる,ヒッパる,ツッパる,テンパる
次のうち、後になるほどと状態が良くなるという意味の言葉はどれ2?,文系,自上がり,胸上がり,尻上がり,中上がり,尻上がり
次のうち、本州にない都道府県はどれ 2?,文系,東京都,京都府,広島県,北海首,北海首
アメリカの都市・ロサンゼルスは、アルファベット2文字で何と略される ?,文系,SF,DC,NY,LA,LA
物事の決着がつかないという意味の言葉「〇〇があかない」。〇〇は回角,文系,かち,らち,いち,まち,らち
ある動物を極端に好んでいたことにちなむ江戸幕府の5代将軍・徳川綱吉のあだ名といえば何 ?,文系,牛公方,犬公方,獲公方,馬公方,犬公方
「我と来て遊べや親のない雀」などの句が収められている、小林一茶の俳諾俳文集は何 ?,文系,おらが秋,おらが冬,おらが上夏,おらが春,おらが春
"ラテン語
ン語で 「
規範」という意味がある、労働の基準量を指す言葉は何 ?",文系,ダルマ,ヴァルマ,ノルマ,カルマ,ノルマ
茨城県の倍楽園、岡山県の後楽園とともに「日本三名園」に数えられる石川県の庭園は何 ?,文系,"近導
ヽ園",擦五園,舞八園,舞七園,"近導
ヽ園"
「食門十哲」と呼ばれる優秀な弟子たちを従えた、江戸時代の俳人は_上:壮4,文系,松尾色焦,石川哨木,与謝無村,小林一茶,松尾色焦
これまでに、鳩山由紀夫、菅直人、野田佳彦ら3人の内閣総理大臣を輩出した政党はどこ?,文系,正義党,労働党,共和党,民主党,民主党
国際法上で、特定の外国人が、滞在国の法律の支配を受けないという権利のことを何という ?,文系,治外法権,不逮捕特権,基本的人権,能免権,治外法権
古代中国で同盟を結ぶ際に行われた習慣に由来する、団体の支配者になることを指す言葉は何 ?,文系,豚和具を執る,犬省を執る,猫古を執る,牛耳を執る,牛耳を執る
毎年7月4日に定められているアメリカの息祭日といえば何 ?,文系,終戦記念日,結婚記念日,意法記念日,独立記念日,独立記念日
俳句を交えた紀行文『奥の細道』 を著した、江戸時代の俳人は誰?2_,文系,松尾色焦,小林一人茶,与謝無村,井原西鶴,松尾色焦
シベリア鉄道やバム鉄道などの鉄首が通っている国はどこ ?,文系,アメリカ,インド,カナダ,ロンシア,ロンシア
バチカン市国が位置するのは、ヨーロッパの何という都市の中 ?,文系,ローマ,ベルリン,パリ,ロンドン,ローマ
日本語では「間謀」という、敵対勢力の情報を得るために謀報活動を行う人を何という?,文系,カンパイ,ミートパイ,アンパイ,スバパイ,スバパイ
心理学者ダン・カイリーが提唱した、いつまでも大人になりきれない心理を何症候群という ?,文系,トム・ソーヤー症候群,ピーターパン症候群,ハリー・ポッター症候群,ロビン・フッド症候群,ピーターパン症候群
『アンネの日記』を書いた少女・アンネのファミリーネームは何 ?,文系,フランク,マイヤー,ミュフー,ホフマン,フランク
「天は人の上に人を造らず人の下に人を造らず」という一文が有名な、忠沢議吉の著書は何 ?,文系,文学のすゝめ,学問のすゝめ,生活のすゝめ,経済のすゝめ,学問のすゝめ
「おい地獄さ行ぐんだで ! 」の書き出しでも有名な、プロレタリア作家・小林多喜二の代表作は何 ?,文系,骨高再,,,革工船,革工船
「御徒」を表す地図記号は、何を図案化したもの ?      ー,文系,おみくじ,鳥居,維銭邊,玉串,鳥居
別名を白鷺城という、世界遺産にも登録されている兵庫県にある城は回角,文系,姫路城,松本城,犬山城,彦根城,姫路城
ことわざ「きゅうそ猫をかむ」の「そ」が表す動物は何?,文系,いぬ,うま,ねずみ,ひつじ,ねずみ
世界遺産にも指定されている、フランス西海岸に浮かぶ島の上に建つ修道院は何 ?,文系,モン・サン・ミッシェル,ンモノフ,シモノペトラ,フェラボントフ,モン・サン・ミッシェル
ことわざ「馬の耳に念仏」の意味として正しいのは次のうちどれ?,文系,何を言っても無駄,言い争いが絶えない,アイデアが豊富,昔の人は偉かった,何を言っても無駄
次のうち、ロシア革命を指導した政治家は誰 ?,文系,レーニン,トルーマン,レーガン,リンカーン,レーニン
"日本の政党、共産党の正式名称は「何壮産央
何共産党」?  ーー",文系,労働共産党,日本共産党,元宜共産党,征会共産党,日本共産党
ウパひのpる2導ゆ:9りルルクji叶っだたき23三治仙ではないのはどれ?,文系,プーケット,ハワイ,グアム,サイパン,プーケット
小魚が一杯詰まった和缶詰 「オイル・サーディン」は何のオイル漬け?,文系,アスパラガス,,クジラ,イワシ,イワシ
シベリアなどに分布する、2年以上連続して凍結した状態となっている土地を何という ?,文系,不滅凍土,無限凍土,完全凍土,永久凍土,永久凍土
小説 『若きウェルテルの悩み」や、戯曲『ファウスト』を書いたドイツの作家は誰 ?,文系,サリンジャー,イプセン,ゲーテ,アンデルセン,ゲーテ
雲南市、安来市、出雲市などの都市がある都道府県はどこ?,文系,島根県,秋田県,山梨県,滋貨県,島根県
次のうち、動詞の「する」の謙議語はどれ ?    -,文系,いるす,いかす,いたす,いえす,いたす
密林に暮らす少年モーグリを主人公とする、イギリスの作家・キップリングの小説は何 ?,文系,フェイス・ブック,スケッチ・ブック,オーディオ・ブック,ジャングル・ブック,ジャングル・ブック
ことわざ「弘法も〇の誤り」と「弘法〇を選ばず」の〇に共通して入るものは何 ?,文系,筆,尋,紙,促,筆
次のうち、アフリカ大陸にある国はとれ?,文系,ワニルーン,トカゲルーン,へヘビルーン,カメルーン,カメルーン
日本最古の物語 『竹取物語」に登場するお姫様は誰2?   -,文系,人魚姫,かぐや姫,織姫,親指姫,かぐや姫
次のうち、「言い古された冗談」や「くだらないダジャレ」を意味する王主ヨたぎす<光晴2,文系,おねえギャグ,おやじギャグ,おとなギャグ,おばギャグ,おやじギャグ
次のうち、鎌倉時代に、御家人と主従関係を結んだ役職はどれ ?,文系,大統領,将軍,皇帝,総理大臣,将軍
自分の会計を意味する「抽計」は、次のうちどれにあたる言葉?,文系,丁寧語,擬音語,謙譲語,箋敬語,謙譲語
新たに建てられた劇場で初めて行われる興行を指す言葉「〇〇〇落とし」。 の〇の〇は何 ?,文系,だるま,りんご,つるベ,こけら,こけら
次のうち、江戸幕府の大名の区分にあったものはどれ?,文系,兄藩,親藩,子落,外洪,親藩
大阪、日立、ビリケン、キン肉マンミュージアムから連想される建造物は何 ?,文系,通天閣,後楽園,ー条城,五校郭,通天閣
次のうち、世界三大款教でないのはどれ?                   「,文系,仏教,イスラム教,ユダヤ教,キリスト教,ユダヤ教
複数人で行動する時に気持ちが一致することの例え「〇〇〇の呼吸」。のの]たき口。,文系,だつっうん,がうん,たうん,あうん,あうん
江戸幕末に長崎で海援際を結成した、土佐藩の志士は誰 ?,文系,高杉普作,木戸孝葛,坂本龍馬,西郷隆盛,坂本龍馬
"原題を『アペニ・
県題を『アペニン山且からアンデス山脈まで』という、アミーチスの小説は何?",文系,彼をたずねて三千早,父をたずねて三千里,母をたずねて三千里,嫁をたずねて三千早,母をたずねて三千里
ことわざで、思い切って大きな決断をすることを「どこから飛び降りる」という2?,文系,外問の舞台,清水の舞台,金閣の舞台,東大寺の舞台,清水の舞台
日本に稲作が伝来した、縄文時代の後、古墳時代の前にあたる日本史における時代区分は何時代 ?,文系,弥生時代,加月時代,如月時代,睦月時代,弥生時代
イギリスの章謡集 『マザーグース』に登場する、大きな卵に顔と手足がついたキャラクターは何 ?,文系,ハンプティ・ダンプティ,ウィリー・ウィンキー,ピーター・パイパー,クックロビン,ハンプティ・ダンプティ
「クールビズ」とは、どの季節の服装 ?,文系,夏,冬,秋,春,夏
国語辞典の『広辞苑』 で、「女でない方」と説明されている言葉は何 ?,文系,兄,父,喝,学,学
次のうちアフリカにない国はどれ!?,文系,南アフリカ,ケニア,フラフランス,カメルーン,フラフランス
ビジネスで、填内や取引先に対して行う、商品や企画の提案のための発表を何という?,文系,プレゼン,プレミア,プレスコ,プレママ,プレゼン
ミドコネ(のEキカレだきのaアクリリンクレ(ーチーといえば、どこの国の政治宗 ?,文系,トルコ,パキスタン,ミヤャヤンマー,中国,ミヤャヤンマー
「モデルチェンジ」 「マクドナルド」「司会者」から連想されるアルファベット2文字は何 2,文系,MC,AC,QC,DC,MC
九州地方の県で、最も南に位置しているのは何県 ?,文系,忠岡県,大分県,長崎県,鹿児島県,鹿児島県
日本の「三権分立」の三権にあたるものは、国会、内閣と何?,文系,自衛際,警察,検察,裁剤所,裁剤所
次のうち、技術が優れていることを意味する慣用句はどれ ?,文系,気が立つ,"角   NL
が立つ","腕
が立つ","腹   NL
が立つ","腕
が立つ"
世界の地名で、タクラマカン、コビ、サハラに続く言葉は何 ?,文系,高原,山上服,台地,砂漠,砂漠
若者言葉で、「トッポギ」といえば、突然どこに行くこと ?,文系,導本木,新倫,渋谷,お台場,導本木
次のうち、クリミア戦争で看護に尽力したナイチンゲールにつけられた異名はどれ ?,文系,クリミアの天使,クリミアの姫,クリミアの女王,クリミアの還,クリミアの天使
次のうち、アメリカにあるのはどれ 2?,文系,エッフェル塔,万里の長城,エトワール釧旋門,目由の女紳,目由の女紳
アルファベット5文字で「ASEAN」 と略される地域協力機構は何 ?,文系,アフリカ諸国連合,東南アジア諸国連合,ユーラシア連合,ラテン連合,東南アジア諸国連合
"日本語の品詞で、「赤い」や「丸
の品詞で、  及 \い」
赤!【      「い」といった単語が分類されるのはとれ?",文系,形容詞,連体詞,形容動詞,副詞,形容詞
自都をベルリンに置くヨーロッパの国はどこ 2?,文系,ドイツ,スイス,ギリシャ,オランダ,ドイツ
ジョバンニやカンパネルラなどの人物が登場する宮沢賢治の童話は何 ?,文系,銀河鉄道の,銀河鉄道の朝,銀河鉄道の夜,銀河曜道の昼,銀河鉄道の夜
俗に「三日飼えば三年恩を忘れない」といわれる動物は何 ?,文系,,犬,席,振,犬
ナチスの党首としてドイツで和独裁体制を築き、第二次世界大戦を引き起こした政治家は誰 ?,文系,ヒトラー,ロンメル,ムッソリーニ,ヒムラー,ヒトラー
第二次大戦後の「東西冷戦」の中心となった2カ国は、東のソ連と、西のどこ?,文系,アメリカ,中国,インド,ナチェコ,アメリカ
徳川幕府の第15代将軍は誰 ?,文系,徳川慶剖,徳川秀忠,徳川綱吉,徳川吉款,徳川慶剖
1955年に小説『太陽の季節』 で弁川賞を受賞した、政治家としても有名な人物は誰 ?,文系,猪瀬直樹,田中康夫,東国原英夫,石原慎太郎,石原慎太郎
次のうち、明治時代に樋口一葉が書いた短編小説のタイトルはどれ2?,文系,たけくらベべ,まつくらべ,うめくらべ,さくらくぐくらべ,たけくらベべ
歌舞伎や浄瑠璃に由来する、「その人の本来の力が問われる場面」を意味する言葉は何 ?,文系,正念場,"奈落
示沖",濡れ場,縁切り場,正念場
日本でアニメ化もされた、アルプスを舞台にしたヨハンナ・スピリの旧草又学は何 ?,文系,パクチー,ハイジ,ハイチュワウ,ハイライト,ハイジ
15世紀から19世紀にかけて、沖縄本島を中心に存在した王国はどれ ?,文系,台湾王国,中華人民王国,アイヌ土国,琉球王国,琉球王国
1851年、清で起こった、洪秀全を首條とする大規模な反乱といえば何 ?,文系,易姓天国の乱,歩行者天国の乱,行在天国の乱,太邊天国の乱,太邊天国の乱
奈良時代に編さんされた書物『万葉集』といえば、次のうちどんな種類の書物 ?,文系,歴史書,物語集,日記集,和歌集,和歌集
魚の「喝焼き」といえば、どんな部位を焼いた料理 ?,文系,背骨,頭,腸,尻尾,頭
年齢や個数などを嘘をついてごまかすことを何という3?,文系,さめを読む,さばを読む,さんまを読む,さけを読む,さばを読む
みかんの生産量が日本一の都道府県はどこ2?,文系,北海首,,東京都,和歌山県,和歌山県
全国で一斉に行うストライキのことを、ゼネラルストライキを略して何という2,文系,ゼネイキ,ゼネトラ,ゼストラ,ゼネスト,ゼネスト
新石垣空港、宮古空港、与那国空港などの空港がある都道府県はどこ ?,文系,山口県,大阪府,沖縄県,栃木県,沖縄県
次のうち、約束を直前になって取りやめることを意味する言葉はどれ ?,文系,ドタキャン,アイキャン,ユーキャン,キャンキャン,ドタキャン
第二次世界大戦の激戦地ともなった、ソロモン諸島最大の島といえばとどこ?,文系,ダンカン島,イデラッキョ島,ガダルカナル島,ツマミエダマメ島,ガダルカナル島
都市部の気温が周辺部より高くなる現象を何という ?,文系,ヒートブランド,ヒートアイランド,ヒートグランド,ヒートランド,ヒートアイランド
毎日志こるようなありふれたことを例えた言葉「日常〇〇事」。〇〇は回角,文系,酢飯,余人,冷飯,赤飯,余人
次の日本の元号の内、最も古い時代のものは何2,文系,大正,在成,大化,昭和,大化
「オバマケア」と呼ばれる医療保険制度改革が行われている国はどこ ?,文系,オランダ,イギリス,フラフランス,アメリカ,アメリカ
人口が最も少ない県である、砂丘や二十世紀梨の産地として有名な、中国地方の県は何?,文系,島根県,広島県,岡山県,鳥取県,鳥取県
楽天的な人を例えた言葉「極楽CC)〇つ」。〇〇つ〇に入る生き物は何 ?,文系,みみず,あめんぼ,かえる,とんほぼ,とんほぼ
「論語』などを含む「四書五経」といえば、孔子が唱えた、何という教えの基本書 ?,文系,信教,立教,回教,密教,信教
小説 『ハックルベリー・フィンのC)〇つ』『トム・ソーヤーの〇O〇』。〇〇に入る言葉は何?,文系,兄尼,悲劇,物語,中険,中険
道路標識の「駐車可」に書かれているアルファベットは何?,文系,P,Q,R,S,P
かつては多くの武家屋敷があった、三菱の本視などがある東京のオフィス街はどこ?,文系,線の内,円の内,丸の内,角の内,丸の内
正式名称を「日本電波塔」という、東京の観光名所としておなじみの建造物は何 ?,文系,東京タワー,東京ドーム,東京ビッグザイト,東京ミッドタウン,東京タワー
無駄遣いをしないという意味の言葉「財布のの〇がかたい」。〇〇は回角,文系,そこ,かわ,はし,ひも,ひも
株式会往の株主の中で、最も多くの株式を所有している者を何という ?,文系,筆頭株主,前頭株主,石頭株主,冒頭株主,筆頭株主
IGEuteiEiylutclbAailte還較の頭文字からアルファベット3文字で「IMF」とされる組織は何 ?,文系,国際司法裁列所,国際連合,国際労働機関,国際通貨基金,国際通貨基金
工業地帯はどれ ?,文系,京浜工業地帯,中京工業地帯,北九州工業地帯,阪紳工業地帯,阪紳工業地帯
淡路島が属する都道府県はどこ ?,文系,香川県,兵庫県,,岐阜県,兵庫県
電車やバスが運行している道筋を表した図を何という ?,文系,路線図,間取図,航海図,展開図,路線図
涯字が生まれた国はどこ ?,文系,エジプト,イラク,パキスタン,中国,中国
「預け入れ」「払い戻し」 の金額が記入された、銀行が預金者に発行する帳面を何という ?,文系,預金ノート,預金パスポート,預金通帳,預金免許証,預金通帳
「農水省」と略される中央省庁はどこ 2,文系,外務省,農林水産省,防衛省,総務省,農林水産省
江戸時代、シーボルトが鳴滝塾を開いた都市はどこ 2,文系,京都,函館,長崎,水戸,長崎
滝沢馬琴や十返舎一れといえば、何時代の戯作者2                 「,文系,江戸時代,在安時代,昭和時代,鍵信時代,江戸時代
"ドイツ語の三人
語の三人称で用いられる三つの性別とは、男性、女性と何?",文系,酸性,塩基性,中性,アルカリ性,中性
人のワキとヒザの下に手を入れて模向きに抱きかかえる方法を、何という?,文系,お姫様抱っこ,王様抱っこ,王子様抱っこ,王女様抱っこ,お姫様抱っこ
USエアウェイズやUSスチールといえば、どこの国で生まれた企業 ?,文系,フフランス,イギリス,ロンア,アメリカ,アメリカ
次のうち、七門利に数えられる王様にいるのはどれ 2?,文系,代々木,原宿,恵比寿,渋谷,恵比寿
ある言語で書かれた文章を、他の言語の文章に変換する作業を何という?,文系,こんやく,ほんやく,さんやく,かんやく,ほんやく
5千円札に描かわれている人物は?,文系,聖徳太子,夏目激石,桶口一葉,野口英世,桶口一葉
完全で立泊な物事の中に、わずかな欠点があることを表す言葉は「玉に(〇つ」。 (つのに入る言葉は何?,文系,さず,しみ,ひび,あな,さず
次の世界遺産のうち、イタリアにあるのはどれ2?,文系,和園,コロッセオ,エジンバラ城,トプカブプ宮殿,コロッセオ
ドーバー海峡はイギリスとどこの間にある?                 「,文系,フフランス,タイ,オーストラリア,韓国,フフランス
"局沢賢治の曹
]  治の草話 『:
古『注文の多い料理店』で、2人の紳士が迷い込む料理のとっ:た9円有人",文系,文楽軒,崎陽軒,来々軒,山猫軒,山猫軒
江戸時代に子どもたちが寺子屋で学んだ「読み・書き・〇OO〇OO〇」。 〇〇つつは何 ?,文系,そろばん,みにばん,いちばん,かんばん,そろばん
「チョモランマ」や「サガルマータ」とも呼ばれる、標高8848mの山は何 ?,文系,エベレスト,エレベスト,エストレベ,エベトレス,エベレスト
五所川原市、八戸市、十和田市といえば、いずれもどこの都道府県にある都市 ?,文系,熊本県,兵庫県,山梨県,青森県,青森県
作中で「ロボット三原則」が提起された、アイザック・アシモフの短篤集は何 ?,文系,われはロボット,われは超能力者,われは未来人,われは宇宙人,われはロボット
在家が減亡した、いわゆる「源不合戦」の最後の戦いといえばは何 ?,文系,ーノ谷の戦い,壇ノ浦の戦い,富士川の戦い,屋島の戦い,壇ノ浦の戦い
日本の城で、二条城といえば、どこの都道府県にある ?,文系,京都府,貴岡県,東京都,愛知県,京都府
1910年に武者小路実馬や志軟直攻らによって創刊された文芸雑誌は何 ?,文系,赤樺,日樺,黒樺,青樺,日樺
ゲティスバーグで行った、「人民の」で始まる演説で有名な、アメリカ大統領は誰 ?,文系,ンジエフノアーソン,ワンシントン,モンロー,リンカーン,リンカーン
次のうち、近畿地方にある都道府県はどれ2?,文系,大阪府,鹿児島県,埼玉県,広島県,大阪府
「僕」と「岡田」と「お玉」の3人の恋を描いた、森了鳴外の作品は何 ?,文系,礁,車,銀,9廊,礁
ロンドンの巨大な時計台「エリザベス・タワー」にある鐘の通称は何 ?,文系,ビッグ・ベン,ビッグ・バン,ビッグ・ボン,ビッグ・ブン,ビッグ・ベン
次のうち、多人数に対して少人数で立ち向かっても勝ち目がないという志和泊そり有をヨたすきす2光晴2,文系,多数に無数,多勢に無勢,多量に無数,多者に無者,多勢に無勢
ルーブル美術館はどこの国の世界遺麻?,文系,ドイツ,フフンス,ポーランド,タイ,フフンス
フランス語でマロンといえば!?,文系,カキ,イモ,クリ,ナシ,クリ
次のうち、京都府にある地方はどれ ?           「,文系,丹後地方,日高地方,奄美地方,会津地方,丹後地方
次のうち、大阪市の区にあるのはどれ 2?,文系,荒川区,淀川区,江戸川区,川区,淀川区
傘松公園から見る「股のぞき」の眺望で有名な、日本三景のひとつは回角,文系,田子の浦,東琴坊,天橋立,上高地,天橋立
797年に征夷大将軍に命じられた、在安時代の武将は誰 ?,文系,石原田村麻呂,窪岡田村硫呂,杏仁田村麻呂,坂上田村廊早,坂上田村廊早
チゾンとテイラが生み出した、どんな形にもなれる土から出来たキャラクターを描いた総本は何 ?,文系,ダーダパパ,ボーボパパ,デーデパパ,バーババパババ,バーババパババ
白居易の『長恨歌』の題材にもなった、中国・唐の玄宗皇帝の妃といえば誰 ?,文系,西施,楊貴妃,土昭君,謀美人,楊貴妃
山や丘の斜面に、階段杖につくられた畑を何という?,文系,だんだん畑,ぐんぐん畑,どんどん畑,ばんばん畑,だんだん畑
