Q,Category,K1,K2,K3,K4,A
本能寺の変で織田信長を襲い自害させるが、直後に豊臣艇吉に敗れた、「三日天下」で知られる武将は誰 ?,文系,豊臣秀吉,前田利家,明智光秀,徳川家康,明智光秀
手紙の最後に書き加える「追伸」を、アルファベット2文字で何という?,文系,PT,PV,PS,PU,PS
江戸時代末期に、通称「黒船」で来日し、日本の開国を求めた人物は、のjpまっ:,文系,織田信長,マッカーサー,ペリー,ダルビッシュ,ペリー
次のうち、「首にする」と同じ意味のヨコちの2 8 呆/   ーー,文系,解屋する,雇用する,減給する,昇給する,解屋する
桃太郎のお供じゃないのは?,文系,犬,キジ,に,ネコ,ネコ
第二次大戦後、日本が主権を回復した条約は〇〇〇座和条約。〇〇〇に入る地名は何 ?,文系,ニューヨーク,シカゴ,サンフランシスコ,ロサンゼルス,サンフランシスコ
トニー・ブレアやゴードン・ブラウンなどの和盲相を輩出した、イギリスの政党は何 ?,文系,労働党,教育党,奉仕党,編入党,労働党
次のうち、自分の利和倫だけを重唐する考え方を指す言葉はどれ ?,文系,リアリズム,エゴイズム,モダニズム,ヒューマニズム,エゴイズム
_  『それから』『門』と三部作をなす、夏目激石の小説は何 ?,文系,ーニ二郎,五六郎,七八郎,三四郎,三四郎
横浜市や大阪市など、内閣が制定する法令によって指定された、人口50万以上の市を何という ?,文系,指令指定都市,政令指定都市,命令指定都市,法令指定都市,政令指定都市
次のうち、アジアの国はどれ ?,文系,ベトナム,エジプト,ウルグアイ,スペイン,ベトナム
戦国時代、川中島で、数度に渡って武田信玄と戦った戦国武将といえば上:壮4,文系,今川義元,織田信長,上杉謙信,足利義昭,上杉謙信
次のうち、歴代天皇に存在しない天皇は誰 ?               「,文系,後醍醐天皇,後島物天皇,後白河天皇,"後明治
大旦","後明治
大旦"
クラブなどの接客係の男性のことを指す言葉は何 ?,文系,ポスト,ホスト,ミスト,マスト,ホスト
フィリピンの和正都はどこ?,文系,セブ,マニフ,ケソン,バギオ,マニフ
多くの観光地があるホノルルといえば、アメリカの何州の州都 ?,文系,アラスカ州,テキサス州,ハワイ州,カリフォルニア州,ハワイ州
国王のルイ14世が完成させた、フランスのパリ郊外にある宮殿は何?,文系,バッキンガム宮殿,シェーンブルン宮殿,サンスーシ宮殿,ベルサイコユ宮殿,ベルサイコユ宮殿
エンゲル係数とは、家計の総支出額に占めるどんな費用の割合のこと?,文系,娯楽費,食費,家賃,養育費,食費
百年戦争で活躍した「ジャンヌ・ダルク」が生まれた国はどこ ?,文系,フフランス,アメリカ,ブラジル,イタリア,フフランス
和歌などを書くのに使われて盛んに用いられるようになったひらがなは、どこの国の文字 ?,文系,ベトナム,中国,日本,韓国,日本
次から次へと場所を変えて酒を飲み歩くことを、俗に何という ?,文系,エレベーター酒,はしご酒,階段酒,タラップ酒,はしご酒
釜石市、久慈市、陸前高田市などの市がある都道府県はどこ ?2,文系,岩手県,島根県,長野県,佐人賀県,岩手県
次のうち、韓国の都市はどれ ?,文系,富山市,釜山市,勝山市,編山市,釜山市
次の警察の階級で、一番上の階級はどれ?                     「,文系,警部補,巡査長,剖中総監,区富正,剖中総監
タイの通貨単位は何 ?,文系,ポンド,ユーロロ,バーツ,ルーブル,バーツ
編井県鯖江市の市民協働プロジェクト「JK課」で、アイディアを提案し主役となるのはどんな人 ?,文系,女子大生,女子高生,女子小学生,女子中学生,女子高生
インダス川流域を領有する、和首都をイスラマバードに置く国はどこ ?,文系,パキスタン,中国,メキシコ,ドイツ,パキスタン
かつて総理大中であった桂、席生に共通する名前は何 ?,文系,太郎,次郎,四郎,三郎,太郎
ギリシャ紳ち話のエロスにあたる、口ーマ四話の愛の紳は何 ?,文系,シンドバッド,キューピビピッド,ユークリッド,ロビンフッド,キューピビピッド
電話通話料を着信側が負担する、「0120」で始まるNTTの電話サービスは何 ?,文系,ゼロダイヤル,フリーダイヤル,ペーパーダイヤル,パスダイヤル,フリーダイヤル
雑誌『赤い鳥』の創刊号に掲載された、草川龍之介の短編小説は何 ?,文系,閉昧の糸,貝の和糸,靖暴の糸,蝶の糸,閉昧の糸
ヨーロッパの多くの国が導入している統一通貨は何2?,文系,ユースズス,ユーロロ,ユーカ,ユーリ,ユーロロ
次のうち、地位や立場を失うことを意味する言葉はどれ?,文系,失脚,失腕,失膝,失胸,失脚
1853年にペリーが黒船を率いて来航した場所はどこ2?2,文系,因館,,碧戸,清買,清買
中世ヨーロッパで起こった百年戦争といえば、フランスとどの国の間の戦 ?,文系,ポボポルトガル,イギリス,ギリシャ,ロンシア,イギリス
リアンネの日記』の著者アンネ・フランクが、最初に日記を記したのは何歳の誕生日 ?,文系,33歳,73歳,13歳,53歳,13歳
司馬遼太郎の小説『燃えよ剣」の主人公として描かれた、新選組の副長は誰 ?,文系,土方歳一,土方歳三,土方歳四,土方歳二,土方歳三
児童文学『銀河鉄道の夜』や『風の又三郎』を書いた作家は誰 ?,文系,正岡子規,夏目激石,石川哨木,沢賢治,沢賢治
紀吐之が仮名書きで旅の様子を描いた文学作品『〇つ〇日記』。〇〇は回角,文系,,伊予,土佐,阿波,土佐
607年、中国の階に小野妹子を派遣した人物は誰2,文系,聖徳太子,徳川家康,,足利価氏,聖徳太子
国連常働理事国5ケヶ国に入っている回陣東,文系,カンボジア,バングラディッシュ,ブータン,中国,中国
次のうち、世界遺産にも登録されている観光名所はどれ?,文系,法隆寺,東京スカイツリー,リニア鉄道館,横浜赤レンガ倉庫,法隆寺
次のうち、「中東地方」に位置する国はどれ ?    ー,文系,イギリス,マレーンア,ロンア,サウジアラビア,サウジアラビア
「天は人の上に人を作らず」という言葉が有名な、編沢議吉の著作は「何のすゝめ』 2?,文系,商売,政治,連動,学問,学問
「選はばれた者」という意味がある、視会や集団において指導的な立場にある居を指す言葉は何 ?,文系,モヒート,エリート,スマート,サポート,エリート
弁護士や司法書士の資格を管轄する官庁は何2          「,文系,外務省,防衛省,法務省,環境省,法務省
次のうち、「錠を開けるために作られた、元の鍵とは別の鍵」を意味する言葉はどれ ?,文系,分け鍵,ニつ鍵,共の鍵,合い鍵,合い鍵
摩周滑や阿票湖などの湖がある都道府県はどこ?,文系,"宇
表条県",山形県,北海道,秋田県,北海道
「株式」を発行し、投資家から調達した資金で活動する会仁を、普通、何という3?,文系,株式会計,合資会福,有限会計,合名会計,株式会計
パリのものが有名な、軍際の帰還を祝うために建てられた大きな門を何という2,文系,大手門,校門,揚手門,競旋門,競旋門
一見簡単そうなことでも初めてやるのは難しい、ということを「コロンブスの何」という ?,文系,卵,ベーコン,トマト,レタス,卵
次のうち、自国を経由して行われる他国間の貿易を指す言葉はどれ ?,文系,中継貿易,ワンポイント貿易,先発買易,抑え貿易,中継貿易
土器の模様から名付けられた、旧石器時代と弥生時代の間とされる日本の時代区分は何 ?,文系,縄文時代,網文時代,綱文時代,糸文時代,縄文時代
日本の中央省庁のうち、外国為替や国の予算、決算などを司るのは何三半4,文系,財務省,文部科学省,農林水産省,国土交通省,財務省
アメリカの1ドル紙幣に描かれている初代大統領は誰 ?,文系,ブッシュ,ケネディ,ニクソン,ワシントン,ワシントン
次のうち、エジプトやナイジェリアがあるのはどこ3?,文系,南アメリカ,アフリカ,北アメリカ,ヨーロッパ,アフリカ
次のうち、夜遅くまで起きていることを意味する言葉はどれ?,文系,夜ふかし,夜焼き,夜転がし,夜大学,夜ふかし
"「中学受験」で、入学試験を受けるのは、普通、:
、次のうちどの学年 ?",文系,小学6年生,中学3年生,大学4年生,高校3年生,小学6年生
俳句の上の句の字数はいくつ?,文系,7字,5字,3字,9字,5字
トヨタ目動車の本軒がある都道府県はどこ2?,文系,愛知県,三重県,岐阜県,静岡県,愛知県
次のうち、相思相愛の男女が2人きりで暮らす家を例えた言葉はどれ2?,文系,愛の城,愛の宿,愛の館,愛の果,愛の果
成長するに従って名前を変えていく魚を何という ?  「,文系,出世魚,進化魚,向上魚,発展魚,出世魚
卑弥呼という女王が治めていた、かつての日本にあった国はどこ 3?,文系,やみ人台国,みや台国,やま台国,まや台国,やま台国
世界遺産にも登録されている小税原諸島はどの都道府県に属している 2?,文系,東京都,鹿児島県,奈川県,沖縄県,東京都
道路標識の「踏切あり」に描かれているものはどれ?2,文系,バイク,バス,電車,目転車,電車
シェイクスピアの「四大悲劇」とは『ハムレット』『マクベス』『オセ口』と何 ?,文系,リア充,リア友,リアタイヤ,リア土,リア土
千葉県の大部分が含まれる、太在洋と東京湾を分ける生島は何 ?,文系,下北千島,能登年島,房総生島,隆摩生島,房総生島
飛騨山脈、木溝山脈、赤石山脈の3つのことをまとめた、ある山有賑にたと人:ヨたちく申半/,文系,日本アルプス,日本アンデス,日本ヒマラヤ,日本カラコルム,日本アルプス
岩手県から宮城県にかけて流れる、東北地方最大の河川は何 ?,文系,北右川,北左川,北下川,北上川,北上川
原題を『BUSHIDOTheSoulofJapan』」という、新渡戸稲造の著書は何 ?,文系,武士道,書道,華道,"=
茶道",武士道
「人民の、人民による、人民のための政治」の演説をした、アメリカの第16代大統領は誰 ?,文系,ケネディ,ワンシントン,ルーズベルト,リンカーン,リンカーン
アメリカの景勝地、アンテロープ・〇つつ〇〇やグランド・〇〇〇の〇〇〇は何 ?,文系,オピニオン,キャニオン,ドミニオン,コンパニオン,キャニオン
物事が間単にできるという意味の言葉「お茶の子OつO〇」。〇〇〇は回角,文系,さいさい,はいはい,かいかい,あいあい,さいさい
正岡子規の俳句「柿食えば鐘が鳴るなり〇〇〇」。〇〇〇に入る言葉は回角,文系,法隆寺,建仕寺,龍安寺,東大寺,法隆寺
希望や幸起に満ちている状態のことを、ある植物の色に例えて「何色」という2,文系,チューリップ色,ヒマワリ色,サクラ色,バラ色,バラ色
魅我氏や物部氏など、古代日本で勢力を誇った士族たちを特に何という?,文系,杏族,華族,衝族,遺族,杏族
江戸幕府がキリスト教禁止のために行った絵踏で踏まはせた木板や銅板には、誰の絵が彫られていた ?,文系,水戸黄門,ペリー,徳川家康,キリスト,キリスト
"「先生と私」「両親と私」「先生と遺書」の
3編
からなる、夏
、夏目激
激石の小説は何?",文系,こころ,人間和失格,舞姫,生門,こころ
元々イギリスのビール会仁によって作られた、様々な世界一の記録を集めた本は何 ?,文系,カールスバーグブック,バドワイザーブック,ギネスブック,ハイネケンブック,ギネスブック
江戸幕府の初代将軍は徳川家康、第2代将軍は徳川秀忠ですが、第3代将当ちお : 半4,文系,徳川綱吉,徳川家光,徳川鹿喜,徳川吉款,徳川家光
「ハクション!」といったら、どんな生理現象を表す時の表現 ?,文系,しゃっくり,あくび,げっぷ,くしゃみ,くしゃみ
コロラド川の浸食によって形成された、アメリカ・アリゾナ州にある大足谷は何?,文系,グランドキャニオン,ビッグキャニオン,ゴールドキャニオン,スーパーキャニオン,グランドキャニオン
カナダと隣援している国は?,文系,台湾,中国,アメリカ,タイ,アメリカ
ニニ千円札に描かれ、沖縄の観光名所にもなっている門は何 ?,文系,内御門,建礼門,守礼門,応天門,守礼門
。 ワークの〇〇、カー〇〇〇、ルーム(つつ)の〇の〇〇に入る、「共有」 を意味する言葉は何?,文系,ファイリング,カップリング,シェアリング,サンプリング,シェアリング
短期の賃貸を「レンタル」というのに対して、長期の賃貸を何という 2?2,文系,リース,ケース,ホース,コース,リース
他人に気に入られるように振る舞って、上自分の利益をはかることを、ある食べ物を使って何という ?,文系,ごまをする,えびをむく,こめをたく,いもをほる,ごまをする
商品の宣伝のために個人宛に郵送されるDM。略さずいうと何メール ?,文系,デラックスメール,ドキュメントメール,ダイレクトメール,ドライブメール,ダイレクトメール
草川賞に名を残す日本の作家は草川〇つつ。〇の〇〇に入る言葉は何 ?,文系,鳥之介,犬之介,龍之介,猿之介,龍之介
「いい国作ろう」や「いい箱作ろう」という語呂合わせで覚えるのは何幕府の成立年 ?,文系,室町幕府,明治幕府,鎌凡幕府,江戸幕府,鎌凡幕府
おなじみの早口言葉「〇〇特許許可局許可局長」。〇〇に入る地名は回角,文系,大阪,,京都,東京,東京
イギリスのロンドンにある、英国王至が居住する宮殿はどこ3?,文系,ベルサイコユ宮殿,サンスーン宮殿,シェーンブルン宮殿,バッキンガム宮殿,バッキンガム宮殿
北海道最高峰の旭岳を中心に広がる日本最大の国立公園は何 ?,文系,瀬戸内海国立公園,阿蘇くじゅう国立公園,小等原国立公園,"大雪山
ーートニ
国立公園","大雪山
ーートニ
国立公園"
次のうち、サミットに参加していなしい国はどれ?     「,文系,日本,インド,アメリカ,フフンス,インド
2つの仕事につくことを指す言葉「二足の〇O〇〇を履く」の〇〇〇は回角,文系,ブーツ,下駄,サンダル,わらじ,わらじ
次のうち、「ポンド」という通貨単位を使用している国はどこ ?,文系,アメリカ,イギリス,ロンア,フフンス,イギリス
2つの相反する事柄の間で板挟みになることを何という2,文系,グランマ,コンマ,オニヤンマ,ジレンマ,ジレンマ
「ユニオンジャック」と呼ばれる国旗はどこの国の国旗2,文系,ロンア,イタリア,イギリス,フフンス,イギリス
東京都、紳奈川県、埼玉県など、1都6県から構成される地方はどこ ?,文系,四国地方,近畿地方,九州地方,関東地方,関東地方
次のうち、ある物事を非難や攻撃の対象にして貢めることを意味する言葉はどれ ?,文系,にら玉に挙げる,いか玉に挙げる,ぶた玉に挙げる,やり玉に挙げる,にら玉に挙げる
日本で「上京」と言ったとき、目的地となる都市はどこ ?,文系,京都,東京,京田辺,長岡京,東京
「不動産干」と呼ばれるアメリカの実業家、〇〇つつ〇つ・トランプ。〇〇〇は何 ?,文系,ロックフェラー,カーネギー,フォード,ドナルド,ドナルド
俗に「天の美禄」や「百薬の長」 と呼ばれるものは何 ?,文系,酒,,金,親,酒
暦の西暦は、誰が生まれたとされる年を元年として数えられる ?,文系,ノア,キリスト,ムハンマド,秋凶,キリスト
偽造防止のために紙幣に施す、光に当てると当き上がる模様のことを何という2,文系,ほかし, か し,すかし,あかし,すかし
日本では沖縄などで見られる、河唱汽水域の塩性湿地に成立する森林を何という3?,文系,マンバット,マンボール,マングローブ,マンミット,マングローブ
「ルネサンスの三大発明」といえば維人針盤、活版印刷術と何 ?,文系,戦車,火薬,電球,土偶,火薬
ことわざで、「後は野となれ」に続を:ヨち中 半7   「,文系,川となれ,山となれ,谷となれ,海となれ,山となれ
カトリックの国が、エルサレムを取り返すために派遣した硝征軍を何という ?,文系,千字軍,万字男,百字軍,十字軍,万字男
日本で普通選挙法や治安維持法が制定されたのは西暦何年2     「,文系,1825年,1925年,1625年,1725年,1925年
中世ヨーロッパの「十字軍」といえば、何という宗教の教徒による組織 ?,文系,キリスト教,ヒンドゥー教,イスラム教,仏教,キリスト教
家電量販店のヨドバシ〇の〇〇、ビッ,文系,ラジオ,テレビ,カメラ,ビデオ,カメラ
絵本でおなじみの次のキャラクターのうち、ウサギはどれ2?,文系,ピーターラビット,ピングー,ノンタン,チェブラーシカ,ピーターラビット
"日本公害運
本公害連動の原点とされる事件(OO〇つつ鈴毒事件」。〇〇〇は何 ?",文系,手尾金山,腰尾銀山,足尾銅山,選尾吹山,足尾銅山
漫画家の小栗左多里が夫との結婚生活を綴ったコミックエッセイといえば『ダーリンは何』 ?,文系,美食家,クイズ圭,外国人,同業者,外国人
豊臣秀吉の五奉行に名を連ね、関ケ原の戦いで指揮官として活躍した武将は誰 ?,文系,石田四成,石田一成,石田二成,石田三成,石田三成
次のうち、キリスト教の宗泊でないものはどれ2?,文系,カトリック,プロテスタント,東方正教,曹洞宗,曹洞宗
日本銀行、帝国ホテル、鹿鳴館などの建築物が建てられたのは何時代 ?,文系,邊安時代,室町時代,鎌倉時代,明治時代,明治時代
「私の知っている野生動物たち』や『大族色グマの伝記』 などからなる、シートンの著書は何 ?,文系,方丈記,動物記,古事記,西遊記,動物記
首都をモスクワに置く、世界最大の面積を誇る国はどこ2?,文系,中国,ブラジル,カナダ,ロンシア,ロンシア
加賀のものが有名な、戦国時代て室町時代に、浄土真宗の門徒が起こした一控を何という ?,文系,百向一撲,十向一反,千向一撲,一向一撲,一向一撲
ニコニコした笑顔のことを、ある宛様に例えて何という 3?,文系,恵比須顔,弁天顔,,寿老人顔,恵比須顔
「憲法の番人」にも例えられる、わが国において司法権を担当し、全国の裁剤所を統括する機関は何 ?,文系,最大裁列所,最良裁列所,最高裁剤所,最上裁列所,最良裁列所
日本の年号で、「下成」のひとつ前は何 ?                 -,文系,明治,大正,昭和,慶応,昭和
次のうち、物語の中で「玉手箱」が登場する昔話はどれ ?,文系,桃太郎,シンデレラ,清島太郎,大きなかぶ,清島太郎
成辰戦争以降の戦死者を祀っている、東京の九段にある細往は何 ?,文系,湯島天紳,香田利視,明治御宮,靖国紳計,靖国紳計
青森県八戸市付近から宮城県牡鹿邊島に至る海岸は次のうちどれ2?,文系,二陸海岸,四陸海岸,一陸海岩,三陸海岸,三陸海岸
次のうち、アフリカ大陸の北西部海上に位置する、スペイン会の諸島はとれ?,文系,キジバト諸島,カナリア諸島,クジャク諸島,フラミンコゴ諸島,カナリア諸島
ある現象やブームが、国や地域におよぼす人金銭的な好影響を何という ?,文系,全体効果,成功効果,往会効果,経済効果,経済効果
"ー   ー
ー    ーー       症和   いすのは摂政ですが、「関」が指すのは何 ?",文系,関白,関青,関時,関赤,関白
世界の七不思議にも数えられるギザのピラミッドがある国はどこ ?,文系,メキシコ,エジプト,アメリカ,イスラフエル,エジプト
次のうち、世界遺産に指定されている島はどれ ?    「,文系,屋久島,小豆島,淡路島,佐渡島,屋久島
次のうち、「お世辞」を意味する言葉はどれ?2    -,文系,あさって,おべっか,あべっく,ちびっこ,おべっか
イギリスにある、巨大な石が円形に並んだ世界遺産といえば何?,文系,ストーンヘンジ,ピラミッド,万里の長城,モアイ像,ストーンヘンジ
アルル、リヨン、グルノーブル、カンヌなどの都市がある国はどこ ?,文系,ケニア,ミヤャヤンマー,フラフランス,アルゼンチン,フラフランス
次のうち、お店で客を引き寄せる娘を意味する言葉はどれ ?,文系,愛娘,一人娘,独娘,看板娘,一人娘
「甲信越地方」の、「甲」は「甲斐」、「信」は「信濃」の頭文字ですが、「越」は何の頭文字 ?,文系,越人,越谷,越後,越冬,越谷
赤い大きな鳥居で有名な、広島県・に2:た円,文系,出雲大視,厳島利視,伊勢紳宮,八坂紳福,厳島利視
どんなに小さく画いものにも相応の志がある、という意味のことわざ。「一寸の虫にも」の続きは何 ?,文系,四分の意,導分の理,三分の心,五分の魂,五分の魂
地方の目治体などが、地元の文化や経済の活性化を目的として行う活動を何という ?,文系,まちおこし,まちひろめ,まちすすめ,まちもどし,まちもどし
次の地図の図法のうち、紳線と経線が直角に交差して描かれるものはどれ?,文系,メルカトル図法,グード図法,サンソン図法,モルワイダ図法,メルカトル図法
後になるほどと状態が良くなることを、グラフの線の形にちなんで何といつ ?,文系,右肩上がり,右肩下がり,左肩上がり,左居下がり,右肩上がり
高村光太郎の有名な詩「僕の前にはない僕の後ろに〇は出来る」のでは何 ?,文系,川,道,山,城,山
日本の都道府県で唯一の「都」は円時,文系,東京都,南京都,西京都,北京都,東京都
1948年以降4度に渡り勃発した、イスラエルと周辺アラブ諸国との武力衝突を何という ?,文系,中東戦争,遠東戦争,近東戦争,極東戦争,中東戦争
昔話 !桃太郎』で、桃太郎たちが鬼退治に向かった島はどこ ?,文系,化ヶ島,虹ヶ伺,雲ヶ島,鬼ヶ島,鬼ヶ島
ののjpまっ38時ELに4 farあのたうり】のNR自分にも害を及ぼすものを指す言葉はとどれ?,文系,水魚の交わり,,諸妃の剣,呉越同舟,諸妃の剣
小中高の学避指導要領の変更により終了した、生徒の負担を減らす教育を何という ?,文系,ゆったり教育,のびのび教育,ゆとり教育,目由教育,ゆとり教育
小説『岸和田少年愚連際』や『プリンセス・トヨトミ』の舞台となっている都道府県はどこ ?,文系,大阪府,沖縄県,広島県,青森県,大阪府
プリンス・エドワード島を舞台にした、モンゴメリーの代表作は 2,文系,青毛のアン,赤毛のアン,黒毛のアン,黄毛のアン,赤毛のアン
在安時代、東北地方に一大勢力を築いたものの、源頼朝に討伐され減ほされた一族は何 ?,文系,奥州藤原氏,詩州藤原氏,米州藤原氏,欧州藤原氏,奥州藤原氏
市内をドナウ川が流れる、ハンガリの 三E:とすず25本,文系,ブダコレラ,ブダエボラ,ブダペスト,ブダチフス,ブダペスト
日本の標準時を定めるための子午線は、東経何度にひかれている ?,文系,1S50,135,120,165,135
土砂で濁った川の色からその名がついた、中国で2番目に長い川は何 ?,文系,,青河,,黄河,黄河
カタカナ語の中でも「和製英語」といえば、どこの国で生まれた言葉 ?,文系,イギリス,日本,オーストラリア,アメリカ,日本
型などがある、ある地域の性別・年上師別人口を表したグラフは何 ?,文系,人口ストーンヘンジ,人口ビピラミッド,人ロロトーテムポール,人口タージマハル,人口ビピラミッド
とかを吉6すニレマルリル】こ4学『土佐日記』の作者は誰 ?,文系,王生忠容,紀友則,紀員之,凡河内農恒,紀員之
