Q,K1,K2,K3,K4,A
「キュー」と呼ばれる長い棒で球を折く球技といえば何 ?,ビリヤード,ビリパーセク,ビリメートル,ビリプランク長,ビリヤード
次のうち、〇の部分に入るのが「の」ではないのはとれ2?,左門くん〇サモナー,斉木楠雄〇W難,黒子ひバスケ,食載つソーマ,左門くん〇サモナー
長野県の県の木にもなっている、 白い樹皮が特徴の木は何 ?,ジングウスギ,シラカバ,フェニックス,ウバメガン,シラカバ
0にセリン2間jpた』度0p】ぶつの森』の舞台となっているのはタカのうちどれ?,ジャングル,マンション,商店街,無人島,無人島
「プロジェクトX 挑戦者たち』のテーマソングとして有名な、中島みゆさのヒット曲は何 ?,地上の宇宙,地上の太陽,地上の月,地上の星,地上の星
オットマー・グッドマンが生み出した「ピングー」といえば、どんな動物のキャラクター ?,ペンギン,ペリカン,キツツキ,フラミンゴ,ペンギン
Jリーグのクラブで「浦和」 といえば後に続く愛称は何2,ベべベガルタ,レッズ,サンガ,アビスパ,レッズ
条昌子、桜田浮子とともに「花の中三トリオ」と呼ばれた女性歌手は上:壮4,山口百恵,山口千恵,山口一恵,山口十恵,山口百恵
「ワイヤレスフィデリティー」を略して名付けられた、無線LANの規格のひとつは何 ?,Y-Fal,WLFI,Wari-Fai,Y-FI,WLFI
アイスホッケーの選手が、試合中に頭にかぶっているものは何 ?,学生帆,ヘルメット,ベレー帽,ナースキャップ,ヘルメット
一次元の「長さ」、二次元の「面積」に相当する、三次元における量は何 ?,堆積,体積,革積,集積,体積
ムッシュ吉崎をリーダーとする、代表曲に『大都会』や『愛をとりもどせ!』 があるロックバンドは何 ?,クリスタルナイト,クリスタルキング,クリスタルプリンス,クリスタルクイーン,クリスタルキング
の224の月中54のjp有あっ介半伝導革ぶ4が高いほうが良いものはどれ?,打率,併殺打数,失策数,防御率,打率
映画『パルプ・フィクション』や『キル・ビル』などを手がけた映画監督は誰 ?,ヴィスコンティ,ダランティーノ,ウォシャウスキー,ウェルマン,ダランティーノ
漫画 !ONE PIECE』に登場するウソップは「何の王様」と呼ばれている ?,脱獄,狙撃,居合,外罪,狙撃
石灰を主成分とする、土木建築用の無機質接合剤を何という ?,セメント,コメント,タレント,イベント,セメント
河合克敏の漫画『うどんちゃん』にを場する「うどんちゃん」の身体は何てでさている ?,大豆,小麦粉,米,そば粉,小麦粉
アニメ『「サザエさん』を放送しているテレビ局は次のうちどれ?,テレビ朝日,フジテレビ,日本テレビ,TBS,フジテレビ
毛根の活動を活発にさせるなどの頭皮のケアのことを何という ?,オーラルケア,メンタルケア,ネイルケア,スカルプケア,スカルプケア
ドラマ 『 年沢直樹』などに出演した、「ラブリン」の愛称で呼ばれる歌舞伎役者は誰 ?,松本幸四郎,尾上松緑,片岡愛之助,中村卿章,片岡愛之助
野球で、守備練習のために野手にボールを打つことを何という?,ロック,ホック,コック,ノック,ノック
格闘ゲームシリーズ『デッド オアアライブ』のアルファベット3文字の略称は何 ?,COA,BOA,DOA,AOA,DOA
次のうち、ナトリウムイオンの表記として正しいものはとどれ?,+Na,+Na+,Na+,N+a,Na+
池や田んぼでよく見かけるカエルの幼生のことを、一般的に何という ?,れんげじゃくし,さじじゃくし,おたまじゃくし,はしじゃくし,おたまじゃくし
_ 国の名前、赤道〇つ〇O、 〇〇〇ビサウ、パプアニュー〇の〇〇の〇〇〇に共通して入る言葉は何 ?,ランド,インド,アイス,ギニア,ギニア
次の柔道の技の中で、抑え込み技ににを導6丈1ゆ】たとず2光8?,横四方固,大腰,痛負投,大外刈,横四方固
日本でサトウキビを栽培している都道府県は次のうちどこ?,岐阜県と長野県,徳島県と香川県,"北海
海道と青森
朋灯県",沖縄県と鹿児島県,沖縄県と鹿児島県
ふつう 、「焼き島」といったときに焼かれている動物は何 ?,アホウドリ,ニワトリ,コウノトリ,コマドリ,ニワトリ
「ビーフステーキ」で、ステーキにされるのは何の肉 ?,ニワトリ,半,牛,ブタ,牛
次のうち、空気中で物が燃えるときに必要な物質はどれ 2?,アルゴン,窒素,二酸化炭素,酸素,酸素
ピクサーのアニメ映画『カーズ』は、何が擬人化したキャラクターが主人公の作品 ?,鉄道,飛行機,船,自動車,自動車
次のうち、ウイスキーの種類にあるのはどれ2?,スイッチ,ステッナチナチ,スコッチ,スオッチ,スコッチ
フィギュアスケートで活躍したキム・ヨナといえば、どこの国の選手?,オランダ,モンゴル,インドネシア,韓国,韓国
13週を1とする、テレビ番組の放送期間の単位は何 2       「,ウール,カール,クール,ポール,クール
江戸幕府の初代将軍は誰 ?,徳川家康,起田信玄,織田信長,豊下秀吉,徳川家康
本名が南出繁と高田昭徳の二人からなる、吉本興業所属のお笑いコンビは何 ?,オール阪御・巨人,オール中日・ヤクルト,オール広島・横浜,オール楽天・西武,オール阪御・巨人
モアイ像で有名な、チリに属する島は何 ?       「,イースター鳥,サウサー但,ウエスター島,ノーサー島,イースター鳥
野球の投手のアンダースローを表す日本語は次のうちどれ?,下手投げ,小手投げ,横手投げ,上手投げ,下手投げ
在安時代の文学作品『竹取物語』で、かぐや姫はどこに帰ってしまう?,地球,火星,金星,月,月
テレビ番組『情熱大陸』のメインテーマの作曲を手掛けた葉加瀬太郎は、何の演奏家 ?,トランペット,バイオリン,ピアノ,クラリネット,バイオリン
「TNo.5」や「No.19」などの香水で知られるファッションブランドは回角,プラダ,アルマーニ,グッチ,シャネル,シャネル
古代中国で同盟を結ぶ際に行われた習慣に由来する、団体の支配者になることを指す言葉は何 ?,和牛耳を執る,犬省を執る,豚鼻を執る,猫古を吾る,和牛耳を執る
次のうち、スポーツにおいて、「相手の選手との距離」という意味がある言葉はどれ ?,わあい,はあい,たあい,まあい,まあい
マゼランやフンボルトなどの種類がある、水族館などでも人気の島は回角,フラミンゴ,カモメ,ハクチョワウ,ペンギン,ペンギン
マグロの赤身を酢飯と海苔で巻いた巻き寿司を何という ?,銅火巻,金火巻,鉄火巻,銀火巻,鉄火巻
ゲーム !『ワールドサッカー ウイニングイレブン 2014』の副題『CX)侍の挑戦』の〇〇は何 ?,和弥き,黒き,含さ,日き,含さ
石炭や重油を燃焼させることでタービンを回し、電気を作ることを何という2,魔力発電,水力発電,火力発電,電力発電,火力発電
「ウナギイヌ 」というキャラクターが登場する、赤塚不二夫の漫画は回角,天才バカボン,鉄腕アトム,銀河鉄道999,ドラえもん,天才バカボン
"登山家の中でも、高度な技術で高難見度の登
登山に
に挑む人のことを特
に何という2",アンディニスト,ロッキニスト,ヒマリニスト,アルピニスト,アルピニスト
「持株会往」を意味する言葉「〈)〇カンパニー」。O〇〇〇は何 ?,ホールディング,テイキング,ハビング,キャッチング,ホールディング
スポーツなどで、失敗した人を励ますためにもちいる言葉はどれ2?,ドンマイ,シンマイ,ゼンマイ,センマイ,ドンマイ
次のファミコンゲームのうち、野球ゲームはとどれ?,ベースボールスター,脱獄,1943,マインドシーカー,ベースボールスター
声優の豊崎、タレントのほしのに共通する名前は何 ?,あさ,はる,で ゆ,なつ,あさ
女子の日本代表チームを、「なでしこジャパン」と呼ぶスポーツは何 ?,野球,新体操,サッカー,カーリング,サッカー
NHKで、生日夜9時から放送されているニュース番組は何 2,ニュースキャッチ9,ニュースグッチ9,ニュースタッチ9,ニュースウオッチ9,ニュースウオッチ9
プロ野球で、病気や怪我を乗り越え再び活躍した選手に贈られる賞は回角,カムバック賞,リバイバル賞,レトロ賞,ロートル賞,カムバック賞
次のうち、ウナギの養殖で有名な静岡県の湖はどれ ?,京名湖,阪名湖,葉名湖,浜名湖,浜名湖
次のうち、「同等、同じ」という意味があるゴルフ用語はどれ ?,フェアワウェイ,パー,パター,バンカー,パー
怒りや不満を、無関係の人に向けて発散することを「何当たり」という?,六つ当たり,八つ当たり,七つ当たり,五つ当たり,八つ当たり
人間にある胃の数はいくつ?,2Zつ,4つ,3つ,1つ,1つ
元笑相の竹下登を宜父に持つ、ロックバンド「BREAKERZ」のボーカルに上:壮4,MAIGO,DAIGO,KENGO,SHINGO,DAIGO
食べものや飲みもので「糖分ひかえめ」と言えば、何の量が少ないこと?,さとう,しお,あぶら,こしょう,さとう
山ちゃんとしずちゃんの2人からなる吉本のお笑いコンビ、南海〇〇〇つ。〇〇の〇は何 ?,キャンディーズ,キャプテン,ピンクレディー,ピーナッツ,キャンディーズ
"生物が、世代
、世代を経る中で、環境に合わせて体を変化させていくことを何という2",深化,老化,劣化,進化,進化
モデルからデザイナーに転身した政美を主人公とする漫画 『デザイナー』の作者は誰 ?,一条ゆかり,三条ゆかり,四条ゆかり,二条ゆかり,一条ゆかり
次のうち、かつて「陸奥国」と呼ばれていた地方はどれ2,東北地方,関東地方,九州地方,東海地方,東北地方
ラジオの司会者を意味する「DJ」とは、「ディスク〇のO〇O〇」 。 のOO〇OOは ?,ジョッキー,ジョーカー,ジャージー,ジャーキー,ジョッキー
"かか              ーーョ
かとの部分が高くなった靴のことを何という2    ー",ハイヒール,ハイカット,ハイボール,ハイテンション,ハイヒール
人気バンド「MAN WITH A MISSION」のメンバー。 身体は人間ですが、頭はどんなお動物という設定 ?,ヒツジ,オオカミ,ブタ,ワシ,オオカミ
沖縄県に生息する飛べない鳥「てCO)〇っクイナ」。〇〇〇は何 ?,ハルバル,ヤンバル,ガンバル,ヨクバル,ヤンバル
カエルやイモリは何類の生き物 ?,路乳類,,,両生類,両生類
010』Eにゴゴ:もmfc多ゆけ/eウルキルレ:さと作して山田家の住人の血を吸うゲームは何 ?,紀,虹,蜂,到,到
中央アジアを通る「シルクロード」は、どんな物品を運んだことにちなんで名付けられた ?,毛糸,費,絹,麻,絹
野球で、走者をさらに先の塁に行かせるための打撃のことを何という ?2,進撃打,進軍打,進較打,進学打,進較打
ティーン・ケーメンが発明した、体重移動によって運転する電動立ち乗り二輪車は何?,マルウェイ,タブウェイ,セグウェイ,リムウェイ,セグウェイ
次のうち、ゲーム 『マリオゴルフワールドツアー』に登場しないキャラクターはとれ?,カービィ,ドンキーコング,ピーチ,ワリオ,カービィ
俗に、出場機会のない野球選手が「温める」といわれるものは何 ?,スパイク,ベンチ,グローブ,バット,ベンチ
漫画『ドラゴンボール』に登場するマジュニア。彼のお父さんは何大魔土 ?,オカリナ大魔王,ピッコロ大魔王,チャルメラ大魔王,フルート大魔王,ピッコロ大魔王
SAと略される、高速道路にある給油・食事・手洗いなどの設備を整えた休憩所は何 ?,サービスエリア,インターチェンジ,パーキングエリア,ジャンクション,サービスエリア
女性漫才コンビ、いくよ・くるよと具ときたとうにゴちく円7,"どっ
ープ",東,中,春,"どっ
ープ"
次のうち、バット、グローブ、ボー月るEpXのの】ちす2光時7,卓球,テニス,野球,サッカー,野球
藤沢とおるの漫画『湘南純愛組 ! 』で、主な舞台となっているのは何県 ?,奈川県,千葉県,静岡県,埼玉県,奈川県
次のうち、元々は、映画業界で「快晴」を指した言葉はどれ ?,ビピーカン,タータン,ビピータン,ワータン,ビピーカン
リトマス試験紙で羊別する性質で、「アルカリ性」の反対は何 ?,性,酸性,陽性,母性,酸性
紳木隆之介が主演した映画『桐島、〇つつ〇つ〇やめるってよ』。〇〇〇に入とを:ちゃ 閉4,クイズ,バイト,部活,受験,部活
料理番組『キユーピー3分クッキング』のテーマソングとして知られる、イエッセルの曲は何 ?,おもちゃの兵際のソナタ,おもちゃの兵際のタンゴ,おもちゃの兵隊のマーチ,おもちゃの兵際のワルツ,おもちゃの兵隊のマーチ
映画 『グラン・ブルー』や『レオン』 に主演した、フランスの俳優は上:壮4,ジャン・コクトー,ジャン・レノ,ジャン・ギャバン,ジャン・バルジャン,ジャン・レノ
しアルリリ【ひ5ミトさ<の【ク) トクアミにさとタん全て等しい四角形はどれ ?,長方形,正方形,座行四辺形,ひし形,正方形
オーストラリアにある、観光地としたうめも:の】ニレマン=定の!⑨(@】m 5ク」。〇の〇〇は何 ?,ドアーズ,レアーズ,エアーズ,ツアーズ,エアーズ
『クレヨンしんちゃん』の劇場版『爆発 ! 温泉わくわく大決戦』のエンディング曲は何 ?,いい湯だな,ひまわりの家,こんな時こそ焼肉がある,元気でいてね,いい湯だな
野球やゴルフなどで、動作の瞬間にはたらかせる手首の力のことを何という ?,スナッチナチ,スナック,スナッグ,スナップ,スナップ
アニメ 『シティーハンター』の主人公、湖秘猿の声を演じた声優は誰 ?,千葉繁,利谷明,二又一成,古川登志夫,利谷明
ヨーグルトの名前にもなっている、イランやカザフスタンに囲まれた世錯最大の湖は何 ?,紅海,カスピ海,地中海,妹海,カスピ海
「明治」と「昭和」の間にあった、日本の元号は何2 。,大将,大勝,大,大正,大正
本田圭佑、長友佑都、香川真司といえば何の選手?   ー,水泳,野球,サッカー,マフソン,サッカー
ロシア語で「水」という意味がある、アルコール度数の高い蒸留酒は回角,ウォーム,ウォッチ,ウォーク,ワウオッカ,ワウオッカ
次のうち、オットセイに似た動物はとれ?,アシバ,アンユ,アシピ,アシカ,アシカ
沖縄や奄美大島では、ハブを退治するために持ち込まれた、別名を「ネコイタチ」という動物は何 ?,レッサーパンダ,ミーアキャット,マングース,アライグマ,マングース
結婚披露宴で、新郎新婦が宴の途中で衣装を変えることを何という?,お色直し,お香直し,お花直し,お楽直し,お色直し
次のうち、「酸性雨」による直接の被天はどれ ?   -,南極の氷が溶ける,オゾン層が破壊される,魚が増えてしまう,条林が枯れてしまう,条林が枯れてしまう
お酒をやめることができない人を指す言葉「〇〇〇中毒」。 〇〇〇は回角,アルコール,アンコール,マンホール,ダンボール,アルコール
短時間に狭い地域で降る大量の雨のことを、奇襲に例えて何という ?,アタック杏雨,レンジャー愛雨,ゲリラ豪雨,サプライズ裏十,ゲリラ豪雨
のどぼとけのことを、西洋では「アダムの何」という?,ブドウ,トマト,メロン,リンゴ,リンゴ
横山裕二の漫画『十勝ひとりぼっち暑園』」の舞台となっている都道府県はとご2,沖縄県,北海道,石川県,和歌山県,北海道
フジテレビの番組『全力 ! 脱カタイズ』でMCを務めているお笑い芸人は上:壮4,有田哲在,太田光,田村淳,後藤輝基,有田哲在
命日を「ゲゲゲ忌」という漫画家は誰?,水木しげる,石ノ森章太郎,手塚治虫,藤子・F・不二雄,水木しげる
次の調味料のうち、普通、辛いものはどれ ?,シナモン,タバスコ,酢,砂糖,タバスコ
auの「三太郎」のCMで、桃太郎を演ている俳優は誰 ?,桐谷健太,松田翔太,賞田将晶,演田岳,松田翔太
地球の体積の8割近くを占める、地穀と核の間にある層の名前は何 ?,マンジュワウ,マンボウ,マンモス,マントル,マントル
漫画 リドラえもん』で、ジャイアンの妹のジャイ了が目指している職業は何 ?,声優,漫画家,ファッションモデル,総理大臣,漫画家
おなじみの早口言葉「生麦、生米、〇つつ」。〇の〇つ〇に入る食べ物は回角,生ハム,生肉,生卵,生野楽,生卵
ゲームメーカーの任天堂が本視を構2る関西の市は何市 ?,大阪市,利戸市,京都市,奈良市,京都市
家庭的な様子のことを「〇〇〇ホーム」。〇〇〇は何 ?,バット,ホット,カット,アット,アット
おバカユニット 『!Pabo」のメンバー[なったことがないのは誰?,木下優樹楽,スザンヌ,里田まい,若槻千夏,若槻千夏
カタカナ語の中でも「和製英語」といえば、どこの国で生まれた言葉 ?,オーストラリア,アメリカ,日本,イギリス,日本
元禄文化といえば、何時代に栄えた文化 2,鍵昼時代,江戸時代,明治時代,奈良時代,江戸時代
次のうち、いわゆる「探点競技」はとれ?,ゲートボール,スピードスケート,野球,体操,体操
スパゲッティやマカロニといえは、0ひ】EHTの75:革/,ブラジル,イタリア,オーストラリア,モンゴル,イタリア
ドラマ「『邊沢直樹』で、主人公・牛け直樹を演じた俳優は誰 ?,佐々木蔵之介,長谷川博己,堺雅人,西島秀俊,堺雅人
合気道が生まれた国はどこ 2?,日本,タイ,ベトナム,韓国,日本
最初に並べた数字に続くように順番にカードを出していくトランプゲームは何 ?,三並べ,巧並べ,九並べ,五並べ,巧並べ
水面に弱い風が吹いてできる細かい波を何という ?,引き波,さざ波,三角波,砕波,さざ波
冬李五輸で行われるスキージャンプの2種目とは、ノーマルヒルと何 ?,ラージヒル,フライングヒル,ミドルヒル,ショートヒル,ラージヒル
7人組ダンス&ボーカルユニット、三代目Jつ〇つ〇Brothers。〇〇〇に入とを:ちゃ 閉4,JaZZ,R&B,Pop,Soul,Soul
次のうち、野球で、投手が狙ったところにボールを投げる能力はどれ ?,包容力,消臭力,制球力,紳通力,制球力
パソコ ン で、 レアル あこ0/ とルダのサイズを小さくする操作を何という2,濃縮,分割,分散,圧縮,圧縮
次のうち、コンピューターに文字を入力するための機器はどれ?2,ギター,ドラム,キーボード,ベースズ,キーボード
ゲーム 『スーパーマリオブラザーズ』で、マリオは花を取るとどんなことができる?,火の玉を出す,しゃがむ,ハンマーを出す,空を飛ぶ,火の玉を出す
アメリカの国旗に使われている色は、赤、青と何色 ?,緑,黄,紫,日,日
ラテン語で「大きさ」という意味がある、地圭のエネルギーの大きさを表わす指数は何 ?,マグニチュード,マグノックス,マグネシウム,マグネトグラフ,マグニチュード
IF:aしにゴfhきリムY 還にド-ゴRCのにヘレナ島に追放された、フランスの車人は誰 ?,ハンニバル,シーザー,アレキサンダー,ナポレオン,ナポレオン
プロ野球・中日の応援歌の名称は次のうちどれ2?       「,消えよドラゴンズ !,強えよドラゴンズ !,集えよドラゴンズ !,燃えよドラゴンズ !,燃えよドラゴンズ !
EPSときりた3のた6区=|名なワタナベエンターテインメント所属の人物は誰 ?,柳原可奈子,近有藤春楽,やしろ優,大島美幸,やしろ優
アイスホッケーで使われる、円柱型のゴムを何という 2?     「,パック,ピック,ペック,ポック,パック
武田信玄が陣中食にしたという「ほうとう」は、何県の郷土料理 ?,忠岡県,静岡県,山口県,山礎県,山礎県
集団内で特に優れている3人のことを、ある鳥を使って何という ?,三牧スズメ,三物カモメ,三物ツバメ,三狗ガラス,三狗ガラス
靴を履く際などに足に直に履く衣類を何という ?   「,時,時上,靴左,寺石,時
トルコ料理の「シシケバブ」や北海道の「ジンギスカン」で使われるの回の】内用4,イノンシンン,ヒツジ,ウマ,イヌ,ヒツジ
苦い粉薬を包んで飲みやすくする、薄いデンプン肛を何という ?,オブラート,オブライエン,オプチミスト,オブリガート,オブラート
モース硬度でもっとも硬い「硬度10」の標準物質とされる物質は何 ?2,オパール,ダイヤモンド,トパーズ,コランダム,ダイヤモンド
お笑い番組 『〇〇〇のガキの使いやぁへヘへんで! 。〇〇つO〇は何 ?,ナインティナイン,爆笑問題,ダウンタウン,ココリコ,ダウンタウン
次の陸上競技の種目ひかうち、1人ではでさないのはとれ2?,砲丸投げ,三段跳び,800m,4x400mリレー,4x400mリレー
次のうち、「エクスクラメーションマーク」はどれ ?,90,&,,半,
次のうち、1月7日に、刻んでお敵に入れて食べる風特があるのはどれ?,春の七草,秋の七草,夏の七草,冬の七草,春の七草
子宮内で赤ちゃんを取り囲んで保護する液体を何という 2?,牛水,獲水,馬水,羊水,羊水
「申眼鏡」は、次のうち、主にどんなときに使う道具 ?,穫明なものを見るとき,小さいものを見るとき,明るいものを見るとき,遠くのものを見るとき,小さいものを見るとき
医師や化学者が着る上着を、それがどんな色であろうと一般的に何という?,緑衣,青衣,白衣,黒衣,白衣
次のうち、ヨーロッパの国はどれ ?,ソイツ,コイソツ,ドイツ,アイツ,ドイツ
お笑いコンビのロッチかが声を演じる、「dポイント」のCMに登場するキャラクターは何 ?,ポオウム,ポインコ,ポブンチョウ,ポニワトリ,ポインコ
培宮之と土屋伸之の2人からなるお笑いコンビは何 ?,クイーン,ポンス,キングス,ナイツ,ナイツ
アニメ『ドラえもん』で、ジャイアンの声を演じている声優は誰 ?,木村史,関智一,松本保典,高木小,木村史
次のうち、ギャグ漫画に分類されるのはどれ2?,野球狂の詩,天才バカボン,デビルマン,うしろの百太郎,天才バカボン
陸上の400mハードルで、跳び越すハドルは全部で何台 ?,26台,34台,10台,19台,10台
父を探すためにハンターになった、漫画 『HUNTERxHUNTER』 の主のた本 記一アスリピニンルレ9/,ガン,ゴン,ビン,ジン,ゴン
陸上競技で、オリンピックでは50km20kmで行われる種目は何 ?,マフソン,説歩,障害走,トライアスロン,説歩
「ウィッグ」や「かつら」といえば、普通体のどこに取り付けて使うの放,膝,局,つま先,頭,頭
レストランやナイトクラブなどが集中する繁華街である、東京都港区中部の町は何 ?,八本木,二本木,導本木,五本木,導本木
ピポザルというキャラクターが登場する、ソニー・コンピュータエンタテインメントのゲームは何 ?,4|,パラッパラッパー,どこでもいっしょ,サルゲッチュ,サルゲッチュ
大相撲の本場所において、初日、中日、千秋楽はいずれも何果日にあたる ?,月曜日,日曜日,土曜日,金曜日,日曜日
宛・リチャード、妹・カレンからなる、アメリカの兄妹デュオは何 ?,カーペンターズ,レ・フレール,ビリーバンバン,企川地一丁目,カーペンターズ
次のうち、漫画 『ドラえもん』に登したひみつ道具ではないのはどれ2?,スモールライト,どこでもドア,航時機,アンキパン,航時機
加箇利や大森などが有名な、縄文人が捨てたゴミが積もった遺跡を何という ?,貝塚,旬塚,,を,貝塚
