Q,K1,K2,K3,K4,A
歌舞伎役者で、白員、幸四郎といえば、号は何 ?,片岡,尾上,市川,松本,松本
次のうち、ブラジルの都市はどれ ?,サンパウロ,サンクトペテルブルク,サンモリッツ,サンフランシスコ,サンパウロ
ファッションの新作発表会 「パリコレ」の「コレ」は、何という言葉の略 ?,コレクトコール,コレステロール,コレスポンデント,コレクション,コレクション
レオ・レオニの絵本『スイミー』で、主人公のスイミーはどんな生き物 ?,蛇,,色,人,
ゲームの『ドシン』、スポ根漫画の『星』。 共通して前につく言葉は回角,鋼鉄の,巨人の,海底の,宇宙の,巨人の
長嶋茂雄にちなむ、プロ野球・巨人の永久欠番は何番 ?       「,1番,10番,16番,3番,3番
次のうち、壮の肉を使った鋼料理はどれ?              「,カントクカン,テンアンモン,ジンギスカン,トンチンカン,ジンギスカン
パチンコや競馬などのかけ事のことを何と言う?,キャンセル,ギャンブル,キャンパス,キャンドル,ギャンブル
夏目激石の小説『坊っちゃん』。成長した坊っちゃんがついた職業は回角,医者,偽察到,信介,教師,教師
テレビ朝日系 『お願い!ランキング』のコメンテーターを務める、宮崎出身の料理人は誰 ?,川越達也,春日部達也,大宮達也,川口達也,川越達也
次のうち、ロシアの作家は誰 ?,プーシキン,ゾラ,バルザック,島崎藤村,プーシキン
円を描く時によく使用される、開閉する2本の足からなる器具は何?,コンパス,キャンパス,クレパス,バイパス,コンパス
ウムちとうツンンと:だゴム pょ28バレーボール選手だったのは誰 ?,山本美憂,増田明美,大林素子,八木沼純子,大林素子
次のうち、RPG『ファイナルファンタジー』シリーズに登場しない魔法はとどれ?,サンダガ,ブリザド,ファイラ,ベギラマ,ベギラマ
次のうち、女の子を主人公とする湿画はどれ?,キングダム,嘘喰い,リアル,干物妹 ! うまるちゃん,干物妹 ! うまるちゃん
沖縄では「イラブー」と呼ばれる、ウナギのような細長い体をした海の生き物は何?,ウミネコ,ウミガメ,ウミウン,ウミヘビ,ウミヘビ
「ソネット君」「コココール」 「呼んでる君」といえば、レストランなどにあるどんな人道具 ?,呼び錦,レジスター,卓上ライト,調味料入れ,呼び錦
サッカーで得点のチャンスとなる、相手守備陣の間を抜くパスを何という?,スローパス,スラーパス,スルーパス,スリーパス,スルーパス
次のカプコンのゲームのうち、戦国時代が舞台になっている作品はどれ?,鬼武者,逆転裁独,デビルメイクライ,モンスターハンター,鬼武者
電流を大きく2種類に分けると、直流電流と何?,曲流電流,混流電流,回流電流,,
次のうち、しろの漫画『ヤマノススメ』の題材になっているのはどれ?,ヨット,ビリヤード,登山,"=
茶道",登山
トランプのカードで、「J」と何の略 ?,ジャレコ,ジャック,ジャスト,ジャイブ,ジャック
戦国時代に北条氏の拠点であった、紳奈川県にある城は何 ?,江戸城,小田原城,熊本城,大坂城,小田原城
人間の足の部位に名を残す、かかとが弱点というギリシャ紳話の英雄は上:壮4,バジリスク,オンシンリス,アキレウス,レビドゥス,アキレウス
任天堂のキャラクター、ワリオがかぶっている帽子に描かれているアルファベットは何 ?,L,W,M,P,W
次のうち、調味料はどれ ?,つ,ぬ,す,く,す
タレント・長嶋一門の父の職業は何だった2?,俳優,政治家,指揮者,プロ野球選手,プロ野球選手
実写化された際には堺正章、香取慎吾らが演じた『西遊包』の登場人物は誰 ?,三蔵法師,係悟空,沙情兆,釘八戒,係悟空
世界柔道選手権で、これまでのメダル獲得数が最も多い国はどこ ?,日本,タンザニア,オランダ,キューバ,日本
正六角形に三本の線を引いた図形で表される、簡単な構造の有機化合物は何 ?,ゼンゼン,カンゼン,シンゼン,ベンゼン,ベンゼン
火を通しやすくするため、ニンジンなどを回しながら不規則な形に切ることを何という?,乱切り,崩切り,蔽切り,経切り,乱切り
男子陸上の110mハードル。 飛び越えるハードルの数は全部でいくつ?,10個,1個,100個,1000個,10個
「黒の組織」という国際的犯罪集団が登場する青山剛昌の漫画は何 ?,金田一少年の事件矯,名探偵コナン,探偵学園Q,探偵大シャードック,名探偵コナン
妊娠・出産や、女性に特有の病気を主に診療する、医学の臨床科は何 ?,産婦人科,小児科,外科,内科,産婦人科
漫画『キテレツ大百科』に登場する浪人生の名前は何さん ?2,移四さん,旬二さん,勉三さん,意一さん,勉三さん
乗用車で、連転席の隣の席のことを何という?,助手席,拓還席,補佐席,護衛席,助手席
次のうち、映画『ドラえもん 新・のび太の日本誕生』の舞台となった時代はどれ ?,原始時代,明治時代,府安時代,江戸時代,原始時代
ことわざで、「一日にして成らすず」「すべての道は通ず」などといわれる都市はどこ ?,パリ,ベルリン,ローマ,ロンドン,ローマ
「亜席色の髪の乙女』や『パピヨ ーン』などのヒット曲がある女性歌手は誰 ?,宇多田ヒカル,島谷ひとみ,川本真琴,華原朋美,島谷ひとみ
サッカーの反則の「ハンドリング」とは、次のうちどの部分にボールが触れること?,手,あご,ひざ理,育中,手
AKB48のヒット曲 『上から〇〇〇つつ』。 〇つつ〇つ〇に入る名前は何 ?,トモチン,マエゴゴ,マリコ,アッチャン,マリコ
ごま油や椿油、条種油などを総称して何という?,魚類油,植物油,動物油,昆虫油,植物油
次のうち、魚類に含まれない生物はとれ?,クジラ,サメ,ブラックバス,マグロ,クジラ
ラグビーの試合は、1チーム何人で行われる ?       ー,9人,15人,18人,12人,15人
次のうち、洋服のチェック模様の種類にあるのはどれ2?,ウメガムチェック,フーセンガムチェック,ギンガムチェック,チューインガムチェック,ギンガムチェック
鳥取・山口・広島と隣接する県は?,島根県,沖縄県,北海道,東京都,島根県
次のうち、フジテレビの織田裕二主演のドラマシリーズはどれ ?,眠る大捜査線,踊る大捜査線,迫る大捜査線,走る大捜査線,踊る大捜査線
次のうち、プロ野球選手の契約形態にあるものはどれ?,模擬選手,育成選手,訓練選手,教育選手,育成選手
アメリカの国旗の星は何を表している?,国会議員の数,意味はない,守の数,州の数,州の数
次のうち、魚の種類はどれ ?,なまり,なまわ,なまえ,なまず,なまず
普段から診察してもらっている医者のことを「〇〇〇の医者」という。〇つつ〇は何 ?,かかりつけ,しかりつけ,はかりつけ,たたみつけ,かかりつけ
「アケメネス朝」 「ササン朝」といえば、古代の何という国家の王朝 ?,ペルシンヤ,ブラジル,アメリカ,中国,ペルシンヤ
次のうち、月々、分割で代金を支払うことを指す言葉はどれ?,げっし,げっく,げっぷ,げっと,げっぷ
次のうち、漫画・アニメ・ゲームなどの世界を指す言葉はどれ3?,二次式,二次的,二次元,二次会,二次元
F1の名門チーム「フェラーリ」のレーシングカーのイメージカラーは何色?,紫,緑,赤,日,赤
次のうち、普通、電子回路には使わないものはどれ2,トランジスタ,コンデンサー,メスシリンダー,ダイオード,メスシリンダー
兎中信志の漫画『弟キャッチャー俺ピビピッチャーで! 』の題材となっているスポボーツは何 ?,サッカー,バスケットボール,柔道,野球,野球
次のうち、野球で、守備側の選手を指す言葉はどれ?  「,座手,逆手,野手,素手,野手
毎年7月9日・10日に「ほおずき市」が開催される、東京都台東区の寺はどこ3?,原宿寺,日比谷寺,亀有寺,浅草寺,浅草寺
小説『東京タワー オカンとボクと、時々、オトン』を書いた、文化人・イラストレーターは誰 ?,ルルー・フランキー,ララー・フランキー,レレー・フランキー,リリー・フランキー,リリー・フランキー
井上雄彦の漫画 『!リアル』は、何のスポーツを題材としたもの?2,車いすマラソン,車いすテニス,車いすフェンシング,車いすバスケットボール,車いすバスケットボール
イカやタコが危険を感じた時に吐く、黒い液体のことを何という ?,紙,大,筆,にコ,にコ
藤崎マーケットの「ラララライバ〇)(っ」 と、COWCOWの「あたりまえく)〇つ」。 〇の〇に入る言葉は何 ?,陸上,剣道,水泳,体操,体操
バケツを振り回しても、水がこぼれないのは、何という力が働くから ?2,浮力,揚力,電磁力,遠心力,遠心力
次のうち、Jリーグにあるチームはとれ?,FC名古屋,FC東京,FC大阪,FC編岡,FC東京
メジャーの試合が行われる「ヤンキー・スタジアム」があるアメリカの都市はどこ?,ロサンゼルス,ボストン,シカゴ,ニューヨーク,ニューヨーク
次のうち、植物はどれ ?,"ツン
ツ",ツツイ,ツツリ,"ツミ
ツ","ツン
ツ"
断熱材や梱包材に使われる、気泡を含んだポリスチレンは 「発泡〇〇〇つ」。の〇〇は ?,スプロール,スクロール,スナロール,ステロール,スナロール
妊産婦であることを表す、母と子の姿がデザインされたマークを何という?,エタニティマーク,マタニティマーク,アメニティマーク,セーフティマーク,マタニティマーク
女優の江角マキコが、かつて実業団チームで選手として活躍していたスポーツは次のうちどれ?,卓球,バレーボール,ソフトボール,サッカー,バレーボール
1977年に放送されたアニメ『あらいぐま〇OO』。 の〇〇は何 ?,メスカル,パスカル,ラスカル,オスカル,ラスカル
ひらがな表記の「つくば市」と「つくばみらい市」があるのは何県 ?,茨城県,貴岡県,兵庫県,青森県,茨城県
国内ツアー2年連続賞金女王のプロゴルファー、イ・ボミの出身国はどご2,韓国,ロンア,フィリピン,中国,韓国
アニメ放送版では『世紀末救世主伝説』という沖題がつけられている漫画は次のうちどれ?,ウイングマン,ハイスクール!奇面組,北斗の挙,キン肉マン,北斗の挙
較全ヨミfひとさりjァんムず|レバサルいる、持ち出しが不可能なことを1だ提計=:ヨた 肝,天地無用,禁帯出,泥ぜるな危了,割れ物注意,禁帯出
歌手のマッカートニー、俳優のニューマン、デザイナーのスミスに共通するファーストネームは何 ?,ジョージ,リンゴ,ジョン,ポール,ポール
『島唄』などのヒット曲を歌った、宮沢和史がボーカルを務めたバンドは何 ?,THE BOOM,THE ROOM,THE DOOM,THE Z00M,THE BOOM
二重のガラス瓶の間を真空にした、保温・保冷に用いる容器を何という?,幻術拒,腐法瓶,呪法手,妖術瓶,腐法瓶
発明や商標に関する手続きを行う、経済産業省の外局は何庁?,観光庁,特許庁,水産庁,林野店,特許庁
人間が呼吸する時に使う、酸素を取り入れる騰器は何 ?,いいえ,ノ 一,はい,イエス,イエス
ナスやトマトなどの野茶を、主に収稚される時期から、一般的に何という?,夏野楽,彼岸野楽,正月野楽,冬野楽,夏野楽
Excelの「A1」や「C3」といった1マスのことを何という2,ルエ,エク,クセ,セル,セル
次のうち、一般に「昭和の三大台時 ッ名2と 6MZNM人TO】ちとちず2光2,伊勢湾台風,枕崎台風,至戸台風,カトリーナ,カトリーナ
「春の七草」に含まれる植物はどれ ?      」,アリ,トリ,マリ,セリ,セリ
「亀ト (きぼく) 」や「太占 (ふとまに) 」といえば、古代日本で行われたどんな風浪 ?,耕作,葬式,占い,狩猟,占い
アメリカのテレビドラマ『アルフ』 。主人公アルフの吹き替えを担当したタレントは誰 ?,明石家さんま,タモリ,ビートたけし,所ジョージ,所ジョージ
讃岐うどんのお店を案内する「うどんタクシー」といえば、何県の交通サービス ?,愛妨県,徳島県,高知県,香川県,香川県
「ごめんね、ごめんねぐて」のフレーズでおなじみのU字工事。2人の出身都道府県はどこ ?,"宇
表条県",山形県,栃木県,,栃木県
次のうち、サッカーとボクシングに共通する用語はどれ ?,レジスター,テーブル,ワゴン,カウンター,カウンター
野球で、両チームの選手が投げたり打ったりするものは何 ?,パック,ストーン,ボール,スパイク,ボール
次のうち、サッカー漫画は!,タイガーマスク,名探偵コナン,俺たちのフィールド,タッチ,俺たちのフィールド
ゲーム 「ドラゴンクエスト」シリーズ第1作の最後の病は?,カオス,竜王,ハーゴン,目らの欲,竜王
化学式「CH3CH (OH) COOH」で表れる、たまると疲労の原因になるという物質は何 ?,葉酸,乳酸,アスコルビン酸,リノール酸,乳酸
登山を趣味とする会視員・日々野鮎美を描いた、信濃川日出雄の漫画は回角,働かな いふた り,山と食欲と私,宇宙戦艦テニィラミス,妖怪の飼育員さん,山と食欲と私
西暦2000年における日本の元号は円時,在成,大正,昭和,明治,在成
昭和アニメ、ハクション大魔王。魔土の娘は?,アクビちゃん,さんぼちゃん,ねむいちゃん,おはようちゃん,アクビちゃん
チルチルとミチルの兄妹を主人公とした、メーテルリンクの小説は何 ?,黒い鳥,赤い鳥,白い鳥,育い島,育い島
次のうち、本拠地がドーム球場であるプロ野球チームはどこ2?,広島,中日,阪旭,ヤクルト,中日
腕前を広く知らしめるのにふさわしい、晴れの舞台を何という?,さくら舞台,いちょう舞台,ひのき舞台,すぎ舞台,ひのき舞台
ドレスなどにつける和花の飾りは何 ?,オマージュ,ポボポタージュ,コラージュ,コサージュ,コサージュ
「生きろ。」といえば、スタジオジブリの何という映画作品のキャッチコピー ?,魔女の宅節便,もののけ姫,紅の豚,千と千尋の紳隠し,もののけ姫
ミュージカル『ウエストサイドストーリー』で、ジェット団と対立する不良グループは何 ?,薔薇十字団,シャーク団,血盟団,テンプル騎士団,シャーク団
ストレスや飲みすぎなどによって、表の表面が傷ついてしまう症状を何という2,いんどよう,いろもよう,いかいよう,いさようよう,いかいよう
ゴルフで、プレイヤーに同件 して用具を運んだり、アドバイスしたりする人を何という ?,チャンプ,キャディ,"=  ゃ%
ee】    me
ミーコ",ネッシー,キャディ
サッカーで「レフティ」といえは、どんな選手のこと2,国の代表を引退した,利き足が左,移籍が多い,ドリブルが速い,利き足が左
女優の「ゆう子」と「温子」に共通する名字は何?       ー,大野,遠野,小野,浅野,浅野
数字で、「無限大」を表す記号は円時,90,の,8,CO,CO
"新美南吉の昔話
草話 『ごんぎつね』
っね』に登場する「ごん」はどんな動物 ?",タヌキ,キツネ,ウサギ,ネズミ,キツネ
古典文学『竹取物語』で、竹の中からかぐや姫を見つけたのは誰 ?,竹取の男,竹取の女,竹取の湊,竹取の欧,竹取の欧
マリリン・マンソンが率いるアメリ力のバンドは何 ?,マリリン・マンソン,マゾソソゾソソ・マゾソソソン,マソソソ・ママンソン,マリリン・マソソソ,マリリン・マンソン
夜間に、灯りで虫を引きつけて駆除する装置を何という 2,殺申剤,読峨灯,ゴキジェット,下取り線香,読峨灯
食べ物を体に吸収できるよう分解する働きのことを何という?,消化,代謝,酸化,文化,消化
"カヌーを溝ぐときに使う「権」のことを身語
語で何という 2?2  「",パドル,ボイル,スターン,クリーク,パドル
"アニメ『地獄少女』の主人公、間魔あいが普      1
段着ている服はどれ?",ジャーンジン,セーラー服,体操服,ボディコン,セーラー服
ゴルフクラブで、「アイアン」といえば、その頭部はどんな素材でできている ?,金属,石,木,プラスチック,金属
次のうち、漢字などにつけるフリガナのことを指すことばはどれ2?,ダイヤ,エメフ,ルビ,サファ,ルビ
漫吉画太郎が漫画化した、サン・テクンジュペリの小説『〇の王子さま』。 ては何 ?,海,性,"ワロ
コロ",山,性
将棋で、最も数の多い駒は何 ?,桂馬,金将,香車,歩兵,歩兵
次のうち、実在する星座はどれ ?,おうし座,おうま座,おやぎ座,おぶた座,おうし座
「ボブスレー」といえば、次のうち何に乗って行う競技 ?,自転車,ヨット,そり,飛行機,そり
都会で暮らす学生が、故卿に戻って就職することを「何ターン」という?,Xターン,Uターン,Wターン,Vターン,Uターン
フラン ス料理で、   メニューの by/ 2)客が1品ずつ選ぶ形式を「アラ〇〇〇つ」という。〇〇〇は何 ?,カルタ,カルト,カルキ,カルス,カルト
野球で失策や予期せぬアクシデントなど、ユニークに見えるプレーを傘に何という ?,珍プレー,有プレー,賃プレー,沈プレー,珍プレー
次の芸能人のうち、日本人はどれ?,クラーク・ゲーブル,チャック・ノリス,ユースケ・サンタマリア,モーガン・フリーマン,ユースケ・サンタマリア
スポーツで、 守備をディフェンスというのに対し、攻撃を何という ?,ナンセンス,オフェンス,サスペンス,インテリジェンス,オフェンス
ゆでたジャガイモをつぶして作る料理「〇OO〇OO〇ポテト」。〇〇〇は何 ?,キッシュ,ブッシュ,マッツンシュユ,メッンュユ,マッツンシュユ
次のうち、物事を包み隠さないことを意味する言葉はどれ?,白裸裸,青裸裸,赤裸裸,妹保裸,赤裸裸
次のうち、バレーボールを描いた漫画はどれ2?2,黒子のバスケ,ROOKIES,ハイキュー!!,アイシールド21,ハイキュー!!
次のうち、ノーベル賞にない部門はとれ?,物理学賞,化学党,数学買,生理学医学賞,数学買
「トッグル」とよばれる木製ボタンで留める、丈の短いフード付きのコートは何 ?,ダッフルコート,フロックコート,テールコート,ピーコート,ダッフルコート
NHK連続テレビ小説の1話あたりの放送時間は何分2,15分,60分,30分,45分,15分
体重と身長により肥満度を求める指数、BMIの「B」とはなんのこと 2,ボール,バスト,ボディー,ボトム,ボディー
"のMMIELI【のた:】E【のjpる28還=レさム舞台で
な
い作品は
どれ
フ",YAWARAI,MONSTER,20世紀少年,Happy!,MONSTER
漫画 !ONE PIECE』の麦わらの一味のメンバーで「そげキング」とも呼ばれているのは誰 ?,ロロノア・ゾロ,サンジ,"ナミ
es]
こつ",ウソップ,ウソップ
喜劇俳優を「コメディアン」というのに対し、喜劇女優を何という ?,コメダミーヌ,コメディーン,コメドン,コメディエンヌ,コメディエンヌ
次のうち、「溶岩」ができる場所はどこ2?2         -,砂漠地帯の地表,河川の上流部,北極海の海中,火山の周辺部,火山の周辺部
「保活」という言葉の「保」が意味するものは次のうちどれ2,,保守党,保育園,保険証,保育園
音楽記号で、「フォルテッシモ」を表すのは何 ?,fff,f,ff,mf,ff
人間以外でオリンピックに出場する唯一の動物は何 ?,壮,,豚,牛,
水木しげるの漫画とタイアップした、鳥取県の空港は米子つ〇〇空港。〇の〇〇は何 ?,金太郎,浦島太郎,桃太郎,鬼太郎,鬼太郎
次のうち、集英視が配信している漫下アプリはどれ3?,マンガボックス,少年ジャンプ十,マンガワン,COrmICO,少年ジャンプ十
漫画家ユニット 「藤子不二雄」の2人とは、安孫子素雄と誰2,藤本弘,田島裕之,中澤秀樹,太地大介,藤本弘
次のゲーム機のうち、発売されたのかカもっとも古いのはどれ?,プレイステーション2,プレイステーション4,プレイステーション,プレイステーション3,プレイステーション
十支に登場する動物で、ネズミの次にくるのは何 ?,ゾウ,イノンン,カバ,ワシ,ワシ
ある昆虫の名前が付いた、鉛筆の製造で国内有数のシェアを誇る文羽具メーカーは何 ?,カブトムシ鉛筆,カマキリ鉛筆,トンボ鉛筆,チョウチョ鉛筆,トンボ鉛筆
次のうち、韓国で生まれた格闘技はとれ?,テコンドー,レスリング,柔道,ボクシング,テコンドー
ピザのマルゲリータやパスタのジェノヴェーゼに使われる、シソ科のハーブは何 ?,ルッコフ,バジル,ターメリック,ワコン,バジル
イカの足のことを、倫に何という ?,ゲソ,カラストンビピ,ゴロ,エンペフ,ゲソ
膝沢周邊の小説 ! 盲目剣答返し』 を原作とする、主人公・三村新之永を押いた映画は何 ?,武士の一年,武士の一時間,武士の一世紀,武士の一分,武士の一分
ニシレル: マクヒキスッルシアエニレ「〇〇〇闘魂」。 〇〇〇は何 ?,燃える,牙える,咲える,迷える,燃える
次のうち、「スパガ」と略されるアイドルグループはどれ 2?,SUPER近GiRLS,HKT48,Rev. from DVL,E-girls,SUPER近GiRLS
代表曲に『サウダージ』    「『アゲハ蝶』などがある、岡野昭仁と新腰晴一の音楽バンドは何 ?,ゴスペラーズ,ボポルノグラフィティ,レミオロメン,スキマスイッチ,ボポルノグラフィティ
次のうち、NHK連続テレビ小説 『とと姉ちゃん』」のヒロインの職業はどれ?,符誌編集者,サッカー選手,銀行貞,科学者,符誌編集者
学校の教科「地歴」の、「歴」は「歴史」のことですが、「地」は何のこと2?,地学,地図,地理,地球,地理
薬用シャンプー「スカルプD」を販売しているメーカーはどこ?,アンファー,アンター,デンジャー,ローファー,アンファー
2014年に公開された『ドラえもん』のアニメ映画『〇OO〇OO〇 BY ME ドラえもん』。 〇〇〇は何 ?,WALK,RUN,STAND,SlT,STAND
次のうち、トウモロコシを炒ってつくられるお県子はどれ ?,ナップコーン,ポップコーン,ヒップコーン,リップコーン,ポップコーン
映画『燃えよドラゴン』などに主演した、今は亡き香港の俳優は誰 ?,レッドス・リー,イエロース・リー,グリーンス・リー,ブルース・リー,ブルース・リー
本州最北端の鉄道駅は?,横浜駅(利奈川県),名古屋駅(愛知県),金沢駅(石川県),下北駅(青森県),下北駅(青森県)
本宮ひろ志の漫画『男〇匹ガキ大将』。〇に入る灘数字は何 ?,,白,十,千,
テンプンがほとんどアミロペクチンで粘り気の強い米のことを、うるち米に対して何という ?,せんべい米,もち米,だんご米,おかさき米,もち米
「メジャーリーグサッカー」といえば、どこの国のサッカーリーグ ?,韓国,中国,アメリカ,メキシンコ,アメリカ
次のうち、セミの種類にあるのはとれ 2?,ヒグラシ,カオダシ,ハブランシ,カオナシ,ヒグラシ
「2時間」は何分 ?,240分,180分,60分,120分,120分
の万放23ことpac才のリコンのクラブ名を作ったとき、あまるものはとどれ?,川崎,アント,フロン,ターレ,アント
「革瓜樹」ともいう、熱帯地方で広く<栽植される果物は何 ?,チチイヤ,パパイヤ,ママイヤ,ハハイヤ,パパイヤ
殆ヶ島の鬼を退治したのは?,金太郎,浦島太郎,甘太郎,桃太郎,桃太郎
次のうち、東京23区にある区は?,江東,清瀬,物村,瑞穂,江東
"大きく「温暖」 「構冷」 「停滞」「閉塞」の4パターンに分けられる気家用語といえ
語 と いえば何 2",後線,左線,前線,石線,左線
